{
  "contractVersion": "1.0",
  "key": "HRMS",
  "name": "DeltCRM HRMS",
  "version": "1.0.0",
  "frontendPathTemplate": "/{locale}/app/hrms",
  "apiPath": "/api/hrms",
  "healthEndpoint": "/healthz",
  "readinessEndpoint": "/readyz",
  "permissions": [
    "hrms.employees.read",
    "hrms.employees.manage",
    "hrms.attendance.self.read",
    "hrms.attendance.self.write",
    "hrms.attendance.read",
    "hrms.attendance.manage",
    "hrms.devices.self.read",
    "hrms.devices.self.write",
    "hrms.devices.read",
    "hrms.devices.manage",
    "hrms.leave.self.read",
    "hrms.leave.self.write",
    "hrms.leave.approve",
    "hrms.leave.read",
    "hrms.leave.manage",
    "hrms.payroll.read",
    "hrms.payroll.manage",
    "hrms.documents.read",
    "hrms.documents.manage"
  ],
  "capabilities": [
    "HRMS_EMPLOYEES",
    "HRMS_ORGANIZATION",
    "HRMS_ATTENDANCE",
    "HRMS_LEAVE",
    "HRMS_PAYROLL",
    "HRMS_DOCUMENTS"
  ],
  "eventsConsumed": [
    "platform.tenant.provisioned.v1",
    "platform.product.activation-requested.v1",
    "platform.product.suspension-requested.v1",
    "platform.product.deletion-requested.v1"
  ],
  "eventsPublished": [
    "hrms.tenant.activated.v1",
    "hrms.tenant.activation-failed.v1",
    "hrms.tenant.suspended.v1",
    "hrms.employee.created.v1",
    "hrms.device.registered.v1",
    "hrms.device.approved.v1",
    "hrms.device.blocked.v1",
    "hrms.device.replaced.v1",
    "hrms.device.self-removed.v1",
    "hrms.leave.policy.created.v1",
    "hrms.leave.policy.updated.v1",
    "hrms.leave.balance.adjusted.v1",
    "hrms.leave.submitted.v1",
    "hrms.leave.approved.v1",
    "hrms.leave.rejected.v1",
    "hrms.leave.cancelled.v1",
    "hrms.payroll.settings.created.v1",
    "hrms.payroll.settings.updated.v1",
    "hrms.employee-document.registered.v1",
    "hrms.employee-document.deleted.v1"
  ]
}
